{"$schema":"https://json-schema.org/draft/2020-12/schema","$id":"https://atlas.internationalbrainlab.org/schema/v0.1/feature.schema.json","title":"Feature metadata v0.1","type":"object","additionalProperties":false,"required":["schema_version","id","label","description","unit","value_semantics","representations","artifacts"],"properties":{"schema_version":{"const":"0.1"},"id":{"type":"string","pattern":"^[a-zA-Z0-9][a-zA-Z0-9._-]*$"},"label":{"type":"string","minLength":1},"description":{"type":"string"},"unit":{"type":["string","null"]},"value_semantics":{"type":"object","additionalProperties":false,"required":["quantity","transform","source_population","missing_values"],"properties":{"quantity":{"type":"string","minLength":1},"transform":{"type":"string","minLength":1},"source_population":{"type":"string","minLength":1},"missing_values":{"type":"string","minLength":1},"source_column":{"type":"string"},"qc_filter":{"type":"string"}}},"display":{"type":"object","additionalProperties":false,"properties":{"colormap":{"type":"string"},"range":{"type":"array","minItems":2,"maxItems":2,"items":{"type":"number"}},"scale":{"enum":["linear","log"]}}},"representations":{"type":"object","minProperties":1,"additionalProperties":false,"properties":{"regional":{"$ref":"regional.schema.json"},"volume":{"$ref":"volume.schema.json"},"points":{"type":"object","description":"Reserved future representation. No v0.1 physical contract yet."}}},"artifacts":{"type":"array","items":{"$ref":"artifact.schema.json"}}}}
